js-analytics-click href,photo-box-img src,user-display-name,user-location,friend-count,friend-count 2,review-count,review-count 2,photo-count,icon_svg href 3,photo-count 2,is-elite,is-elite href,arrange href,icon_svg href 4,action-link_label,arrange href 2,action-link_label 2,arrange href 3,action-link_label 3,arrange href 4,action-link_label 4,arrange href 5,action-link_label 5,arrange href 6,action-link_label 6,offscreen src,rating-qualifier,review-content,voting-intro,vote-type,count,vote-type 2,vote-type 3,u-space-b3,u-space-b3 src,u-space-b2,ybtn,js-maybe-later-button,chiclet-link href,tooltip,photo-box-img src 2,biz-shim href,photo-box-img src 3,biz-shim href 2,review-tags_item,icon_svg href 14,count 2,count 3,photo-box-overlay_caption
https://www.yelp.com/user_details?userid=z5TGzRjwH9yGu4b4Ovmawg,https://s3-media1.fl.yelpcdn.com/photo/bRHt2NeX6L34TOfi2tVAiQ/60s.jpg,Levi B.,"Chicago, IL",friends,176,reviews,212,photos,[object Object],118,Elite ’18,https://www.yelp.com/elite,https://www.yelp.com/biz_share/kWOELNlUM14bv0m-slvq6A/review/xdG7qAetabuR3r65uiwirA,[object Object],Share review,javascript:;,Embed review,https://www.yelp.com/thanx?complimentable_id=xdG7qAetabuR3r65uiwirA&complimentable_type=REVIEW&previous_url=https%3A%2F%2Fwww.yelp.com%2Fbiz%2Fintelligentsia-coffee-chicago-8%3Fstart%3D20&user_id=z5TGzRjwH9yGu4b4Ovmawg,Compliment,https://www.yelp.com/mail?action_send_form=1&dst=z5TGzRjwH9yGu4b4Ovmawg&return_url=https%3A%2F%2Fwww.yelp.com%2Fbiz%2Fintelligentsia-coffee-chicago-8%3Fstart%3D20,Send message,https://www.yelp.com/following_user/add?dst_user_id=z5TGzRjwH9yGu4b4Ovmawg&previous_url=https://www.yelp.com/biz/intelligentsia-coffee-chicago-8?start=20,Follow Levi B.,https://www.yelp.com/following_user/remove?dst_user_id=z5TGzRjwH9yGu4b4Ovmawg&previous_url=https://www.yelp.com/biz/intelligentsia-coffee-chicago-8?start=20,Stop following Levi B.,https://s3-media2.fl.yelpcdn.com/assets/srv0/yelp_design_web/9b34e39ccbeb/assets/img/stars/stars.png,6/23/2017,"A couple of coworkers brought me by Intelligentsia recently and I really enjoyed myself. The highest marks belong to the ambiance and just overall style and class of the venue. Otherwise, I have never really been a fan of the coffee at Intelligentsia, it just has some weird, put-off kind of taste to me; hard to explain.Otherwise, I would come back in hopes to find a tea I could enjoy in the cool, modern space that is Inteliigentsia. A definite plus is that the staff members are really nice and helpful.",1 person voted for this review,Useful,,Funny,Cool,Others will see how you vote!,https://s3-media3.fl.yelpcdn.com/assets/srv0/yelp_deanonymize_ufc/f871a0ff7872/lib/img/200x120_ufc_globe.png,"Heads up: From now on, other Yelpers will be able to see how you voted. Want to chime in?","Yes, Let Me Vote!",Maybe Later,https://www.yelp.com/flag_content?biz_id=kWOELNlUM14bv0m-slvq6A&flag_id=xdG7qAetabuR3r65uiwirA&flag_type=review&previous_url=https%3A%2F%2Fwww.yelp.com%2Fbiz%2Fintelligentsia-coffee-chicago-8%3Fstart%3D20,Report review,,,,,1 check-in,[object Object],,1,
https://www.yelp.com/user_details?userid=3O0IrWHOCo7Syfxv_CFYZQ,https://s3-media3.fl.yelpcdn.com/photo/tLX6GoSLXAqP7t3iqhMbFw/60s.jpg,Cristina X.,"New York, NY",friends,434,reviews,447,photos,[object Object],3547,Elite ’18,https://www.yelp.com/elite,https://www.yelp.com/biz_share/kWOELNlUM14bv0m-slvq6A/review/qABK6SankRk86uEvkoVi7w,[object Object],Share review,javascript:;,Embed review,https://www.yelp.com/thanx?complimentable_id=qABK6SankRk86uEvkoVi7w&complimentable_type=REVIEW&previous_url=https%3A%2F%2Fwww.yelp.com%2Fbiz%2Fintelligentsia-coffee-chicago-8%3Fstart%3D20&user_id=3O0IrWHOCo7Syfxv_CFYZQ,Compliment,https://www.yelp.com/mail?action_send_form=1&dst=3O0IrWHOCo7Syfxv_CFYZQ&return_url=https%3A%2F%2Fwww.yelp.com%2Fbiz%2Fintelligentsia-coffee-chicago-8%3Fstart%3D20,Send message,https://www.yelp.com/following_user/add?dst_user_id=3O0IrWHOCo7Syfxv_CFYZQ&previous_url=https://www.yelp.com/biz/intelligentsia-coffee-chicago-8?start=20,Follow Cristina X.,https://www.yelp.com/following_user/remove?dst_user_id=3O0IrWHOCo7Syfxv_CFYZQ&previous_url=https://www.yelp.com/biz/intelligentsia-coffee-chicago-8?start=20,Stop following Cristina X.,https://s3-media2.fl.yelpcdn.com/assets/srv0/yelp_design_web/9b34e39ccbeb/assets/img/stars/stars.png,7/22/2016,"Intelligentsia is a really nice cosy place in loop. Highly professional staff and great coffee quality. I ordered the almond cappuccino made from Kunga Maitu, Kenya beans. It has the typical berry/black current flavor of Kenya beans. Overall profile is very well balanced and smooth. It smells woody and nutty with a consistent beauty-berry-sour taste. The finish is bitter and neat.Enjoyed the visit. Will try out the New York location too. Congrats intelligentsia on making the 20 year anniversary! May the goodness continue for another 20 years!",8 people voted for this review,Useful,5,Funny,Cool,Others will see how you vote!,https://s3-media3.fl.yelpcdn.com/assets/srv0/yelp_deanonymize_ufc/f871a0ff7872/lib/img/200x120_ufc_globe.png,"Heads up: From now on, other Yelpers will be able to see how you voted. Want to chime in?","Yes, Let Me Vote!",Maybe Later,https://www.yelp.com/flag_content?biz_id=kWOELNlUM14bv0m-slvq6A&flag_id=qABK6SankRk86uEvkoVi7w&flag_type=review&previous_url=https%3A%2F%2Fwww.yelp.com%2Fbiz%2Fintelligentsia-coffee-chicago-8%3Fstart%3D20,Report review,https://s3-media4.fl.yelpcdn.com/bphoto/axJAwgxduDaRxt0fi8B0gw/348s.jpg,https://www.yelp.com/biz_photos/intelligentsia-coffee-chicago-8?reviewid=qABK6SankRk86uEvkoVi7w&select=axJAwgxduDaRxt0fi8B0gw,https://s3-media1.fl.yelpcdn.com/bphoto/6SCES4qj9RR2mfcqUi5r5g/168s.jpg,https://www.yelp.com/biz_photos/intelligentsia-coffee-chicago-8?reviewid=qABK6SankRk86uEvkoVi7w&select=6SCES4qj9RR2mfcqUi5r5g,1 check-in,[object Object],3,6,"Kunga Maitu, Kenya beans made in cappuccino"
https://www.yelp.com/user_details?userid=q3I5xUA2AGdYdbDW9tEXfQ,https://s3-media2.fl.yelpcdn.com/assets/srv0/yelp_styleguide/514f6997a318/assets/img/default_avatars/user_60_square.png,Mshideawyy H.,"Chicago, IL",friends,17,reviews,10,,,,,,https://www.yelp.com/biz_share/kWOELNlUM14bv0m-slvq6A/review/rUV2Q-gnaN2KQTfMKf4JgA,[object Object],Share review,javascript:;,Embed review,https://www.yelp.com/thanx?complimentable_id=rUV2Q-gnaN2KQTfMKf4JgA&complimentable_type=REVIEW&previous_url=https%3A%2F%2Fwww.yelp.com%2Fbiz%2Fintelligentsia-coffee-chicago-8%3Fstart%3D20&user_id=q3I5xUA2AGdYdbDW9tEXfQ,Compliment,https://www.yelp.com/mail?action_send_form=1&dst=q3I5xUA2AGdYdbDW9tEXfQ&return_url=https%3A%2F%2Fwww.yelp.com%2Fbiz%2Fintelligentsia-coffee-chicago-8%3Fstart%3D20,Send message,https://www.yelp.com/following_user/add?dst_user_id=q3I5xUA2AGdYdbDW9tEXfQ&previous_url=https://www.yelp.com/biz/intelligentsia-coffee-chicago-8?start=20,Follow Mshideawyy H.,https://www.yelp.com/following_user/remove?dst_user_id=q3I5xUA2AGdYdbDW9tEXfQ&previous_url=https://www.yelp.com/biz/intelligentsia-coffee-chicago-8?start=20,Stop following Mshideawyy H.,https://s3-media2.fl.yelpcdn.com/assets/srv0/yelp_design_web/9b34e39ccbeb/assets/img/stars/stars.png,5/29/2018,"Why does this place exist is my question. The prices are outrageous.The staff is very rude. This place really could use diversity training.In my opinion, any coffee shop beats this place.  What does it cost to have some customer service and a smile? They remodeled the store but not the attitudes of the staff. Re do everything not just one thing.",voted for this review,Useful,,Funny,Cool,Others will see how you vote!,https://s3-media3.fl.yelpcdn.com/assets/srv0/yelp_deanonymize_ufc/f871a0ff7872/lib/img/200x120_ufc_globe.png,"Heads up: From now on, other Yelpers will be able to see how you voted. Want to chime in?","Yes, Let Me Vote!",Maybe Later,https://www.yelp.com/flag_content?biz_id=kWOELNlUM14bv0m-slvq6A&flag_id=rUV2Q-gnaN2KQTfMKf4JgA&flag_type=review&previous_url=https%3A%2F%2Fwww.yelp.com%2Fbiz%2Fintelligentsia-coffee-chicago-8%3Fstart%3D20,Report review,,,,,,,1,,
https://www.yelp.com/user_details?userid=HUWPfofYNyttE2NqxAxJlQ,https://s3-media2.fl.yelpcdn.com/photo/wj6zLtUaEnkuXO36ArPGWA/60s.jpg,Belle L.,"Chicago, IL",friends,108,reviews,979,photos,[object Object],3275,Elite ’18,https://www.yelp.com/elite,https://www.yelp.com/biz_share/kWOELNlUM14bv0m-slvq6A/review/FTs_ES4M1c9ZATjmmUcPlw,[object Object],Share review,javascript:;,Embed review,https://www.yelp.com/thanx?complimentable_id=FTs_ES4M1c9ZATjmmUcPlw&complimentable_type=REVIEW&previous_url=https%3A%2F%2Fwww.yelp.com%2Fbiz%2Fintelligentsia-coffee-chicago-8%3Fstart%3D20&user_id=HUWPfofYNyttE2NqxAxJlQ,Compliment,https://www.yelp.com/mail?action_send_form=1&dst=HUWPfofYNyttE2NqxAxJlQ&return_url=https%3A%2F%2Fwww.yelp.com%2Fbiz%2Fintelligentsia-coffee-chicago-8%3Fstart%3D20,Send message,https://www.yelp.com/following_user/add?dst_user_id=HUWPfofYNyttE2NqxAxJlQ&previous_url=https://www.yelp.com/biz/intelligentsia-coffee-chicago-8?start=20,Follow Belle L.,https://www.yelp.com/following_user/remove?dst_user_id=HUWPfofYNyttE2NqxAxJlQ&previous_url=https://www.yelp.com/biz/intelligentsia-coffee-chicago-8?start=20,Stop following Belle L.,https://s3-media2.fl.yelpcdn.com/assets/srv0/yelp_design_web/9b34e39ccbeb/assets/img/stars/stars.png,7/25/2016,"Affordable High Quality.  Love and Loyal to Intelligentsia since Lakeview and Day 1 of this location.MENU -- I love options!  Sophisticated than ever.  Quality beans.  Generous standardized Art Latte.  MACCHIATO automatically came with lightly fizzy water.  The ANGELENO with 4 shots of espresso for $5.5 is an excellent value.  You can have 2.5 shots for half the price.  How hard does your heart palpitate?  *wink*VENUE -- plenty of comfortable seating that easily gets crowded.  2 unisex bathrooms.  Due to limited space, this cafe is not meant for hours-and-hours of lounging.",2 people voted for this review,Useful,2,Funny,Cool,Others will see how you vote!,https://s3-media3.fl.yelpcdn.com/assets/srv0/yelp_deanonymize_ufc/f871a0ff7872/lib/img/200x120_ufc_globe.png,"Heads up: From now on, other Yelpers will be able to see how you voted. Want to chime in?","Yes, Let Me Vote!",Maybe Later,https://www.yelp.com/flag_content?biz_id=kWOELNlUM14bv0m-slvq6A&flag_id=FTs_ES4M1c9ZATjmmUcPlw&flag_type=review&previous_url=https%3A%2F%2Fwww.yelp.com%2Fbiz%2Fintelligentsia-coffee-chicago-8%3Fstart%3D20,Report review,https://s3-media4.fl.yelpcdn.com/bphoto/S_V0Q3ciadqoefK6UFKJ1w/168s.jpg,https://www.yelp.com/biz_photos/intelligentsia-coffee-chicago-8?reviewid=FTs_ES4M1c9ZATjmmUcPlw&select=S_V0Q3ciadqoefK6UFKJ1w,https://s3-media3.fl.yelpcdn.com/bphoto/Kb4L2q8NL3p2hkMZTT-Q6w/168s.jpg,https://www.yelp.com/biz_photos/intelligentsia-coffee-chicago-8?reviewid=FTs_ES4M1c9ZATjmmUcPlw&select=Kb4L2q8NL3p2hkMZTT-Q6w,1 check-in,[object Object],1,1,FLETCHA ROJA Macchiato.  The tulip could also look like a vibrating/palpitating heart.
https://www.yelp.com/user_details?userid=gjoQXkA85yK0gHwvclRBbw,https://s3-media4.fl.yelpcdn.com/photo/83ed9pZ5VXACcbI-T8TEkQ/60s.jpg,John M.,"Akron, OH",friends,106,reviews,123,photos,[object Object],423,Elite ’18,https://www.yelp.com/elite,https://www.yelp.com/biz_share/kWOELNlUM14bv0m-slvq6A/review/6ZA3vFyjXvhJQZNKXyIM5w,[object Object],Share review,javascript:;,Embed review,https://www.yelp.com/thanx?complimentable_id=6ZA3vFyjXvhJQZNKXyIM5w&complimentable_type=REVIEW&previous_url=https%3A%2F%2Fwww.yelp.com%2Fbiz%2Fintelligentsia-coffee-chicago-8%3Fstart%3D20&user_id=gjoQXkA85yK0gHwvclRBbw,Compliment,https://www.yelp.com/mail?action_send_form=1&dst=gjoQXkA85yK0gHwvclRBbw&return_url=https%3A%2F%2Fwww.yelp.com%2Fbiz%2Fintelligentsia-coffee-chicago-8%3Fstart%3D20,Send message,https://www.yelp.com/following_user/add?dst_user_id=gjoQXkA85yK0gHwvclRBbw&previous_url=https://www.yelp.com/biz/intelligentsia-coffee-chicago-8?start=20,Follow John M.,https://www.yelp.com/following_user/remove?dst_user_id=gjoQXkA85yK0gHwvclRBbw&previous_url=https://www.yelp.com/biz/intelligentsia-coffee-chicago-8?start=20,Stop following John M.,https://s3-media2.fl.yelpcdn.com/assets/srv0/yelp_design_web/9b34e39ccbeb/assets/img/stars/stars.png,3/25/2017,"Unknown to me, I walked in one minute before the registers closed down for the night.  Whoops.  I was in Chicago for a conference and stopped here because it was on my list of coffee places to visit.  When I got to the register the barista said there was one minute left before it would close.  I really wanted a coffee and they looked as if they were just finishing cleaning up their equipment.  The manager saved the day by offering me a free drip coffee, which was brewed only 20 minutes prior, and we were all happy :)",voted for this review,Useful,2,Funny,Cool,Others will see how you vote!,https://s3-media3.fl.yelpcdn.com/assets/srv0/yelp_deanonymize_ufc/f871a0ff7872/lib/img/200x120_ufc_globe.png,"Heads up: From now on, other Yelpers will be able to see how you voted. Want to chime in?","Yes, Let Me Vote!",Maybe Later,https://www.yelp.com/flag_content?biz_id=kWOELNlUM14bv0m-slvq6A&flag_id=6ZA3vFyjXvhJQZNKXyIM5w&flag_type=review&previous_url=https%3A%2F%2Fwww.yelp.com%2Fbiz%2Fintelligentsia-coffee-chicago-8%3Fstart%3D20,Report review,https://s3-media2.fl.yelpcdn.com/bphoto/aVXI9-eToV5ta6pNQJQj0g/348s.jpg,https://www.yelp.com/biz_photos/intelligentsia-coffee-chicago-8?reviewid=6ZA3vFyjXvhJQZNKXyIM5w&select=aVXI9-eToV5ta6pNQJQj0g,,,1 check-in,[object Object],,1,
https://www.yelp.com/user_details?userid=-32WtapJvTQrG59p6hgVyg,https://s3-media4.fl.yelpcdn.com/photo/5lYOtJLHAjEYBe8pT5lwZQ/60s.jpg,Allan R.,"London, United Kingdom",friends,136,reviews,93,photos,[object Object],103,Elite ’18,https://www.yelp.com/elite,https://www.yelp.com/biz_share/kWOELNlUM14bv0m-slvq6A/review/JwZwrkJ97N3u1PoUFys67g,[object Object],Share review,javascript:;,Embed review,https://www.yelp.com/thanx?complimentable_id=JwZwrkJ97N3u1PoUFys67g&complimentable_type=REVIEW&previous_url=https%3A%2F%2Fwww.yelp.com%2Fbiz%2Fintelligentsia-coffee-chicago-8%3Fstart%3D20&user_id=-32WtapJvTQrG59p6hgVyg,Compliment,https://www.yelp.com/mail?action_send_form=1&dst=-32WtapJvTQrG59p6hgVyg&return_url=https%3A%2F%2Fwww.yelp.com%2Fbiz%2Fintelligentsia-coffee-chicago-8%3Fstart%3D20,Send message,https://www.yelp.com/following_user/add?dst_user_id=-32WtapJvTQrG59p6hgVyg&previous_url=https://www.yelp.com/biz/intelligentsia-coffee-chicago-8?start=20,Follow Allan R.,https://www.yelp.com/following_user/remove?dst_user_id=-32WtapJvTQrG59p6hgVyg&previous_url=https://www.yelp.com/biz/intelligentsia-coffee-chicago-8?start=20,Stop following Allan R.,https://s3-media2.fl.yelpcdn.com/assets/srv0/yelp_design_web/9b34e39ccbeb/assets/img/stars/stars.png,11/12/2017,"They made me an excellent Flat White, despite it not being a menu item :)   Bit of a wait but the place was pretty busy.  Found a seat ok and jumped on the WiFi to do a little work before grabbing another Flat White to go.  Nice ambience and friendly staff with the Hipster vibe",Was this review …?,Useful,,Funny,Cool,Others will see how you vote!,https://s3-media3.fl.yelpcdn.com/assets/srv0/yelp_deanonymize_ufc/f871a0ff7872/lib/img/200x120_ufc_globe.png,"Heads up: From now on, other Yelpers will be able to see how you voted. Want to chime in?","Yes, Let Me Vote!",Maybe Later,https://www.yelp.com/flag_content?biz_id=kWOELNlUM14bv0m-slvq6A&flag_id=JwZwrkJ97N3u1PoUFys67g&flag_type=review&previous_url=https%3A%2F%2Fwww.yelp.com%2Fbiz%2Fintelligentsia-coffee-chicago-8%3Fstart%3D20,Report review,,,,,1 check-in,[object Object],,,
https://www.yelp.com/user_details?userid=WWDtHV2A0Um4vf0zyKO6ZQ,https://s3-media4.fl.yelpcdn.com/photo/a8cXsDXLzZ6gy2hcV80HUA/60s.jpg,Michael M.,"Lake Forest, IL",friends,378,reviews,11,,,,,,https://www.yelp.com/biz_share/kWOELNlUM14bv0m-slvq6A/review/1AraqTRUMoUwvWJisAzt2Q,[object Object],Share review,javascript:;,Embed review,https://www.yelp.com/thanx?complimentable_id=1AraqTRUMoUwvWJisAzt2Q&complimentable_type=REVIEW&previous_url=https%3A%2F%2Fwww.yelp.com%2Fbiz%2Fintelligentsia-coffee-chicago-8%3Fstart%3D20&user_id=WWDtHV2A0Um4vf0zyKO6ZQ,Compliment,https://www.yelp.com/mail?action_send_form=1&dst=WWDtHV2A0Um4vf0zyKO6ZQ&return_url=https%3A%2F%2Fwww.yelp.com%2Fbiz%2Fintelligentsia-coffee-chicago-8%3Fstart%3D20,Send message,https://www.yelp.com/following_user/add?dst_user_id=WWDtHV2A0Um4vf0zyKO6ZQ&previous_url=https://www.yelp.com/biz/intelligentsia-coffee-chicago-8?start=20,Follow Michael M.,https://www.yelp.com/following_user/remove?dst_user_id=WWDtHV2A0Um4vf0zyKO6ZQ&previous_url=https://www.yelp.com/biz/intelligentsia-coffee-chicago-8?start=20,Stop following Michael M.,https://s3-media2.fl.yelpcdn.com/assets/srv0/yelp_design_web/9b34e39ccbeb/assets/img/stars/stars.png,9/12/2017,$4.46 for a medium cup of coffee? LOL!!!Why on earth would anyone return? Is the coffee that great? Nope.,voted for this review,Useful,2,Funny,Cool,Others will see how you vote!,https://s3-media3.fl.yelpcdn.com/assets/srv0/yelp_deanonymize_ufc/f871a0ff7872/lib/img/200x120_ufc_globe.png,"Heads up: From now on, other Yelpers will be able to see how you voted. Want to chime in?","Yes, Let Me Vote!",Maybe Later,https://www.yelp.com/flag_content?biz_id=kWOELNlUM14bv0m-slvq6A&flag_id=1AraqTRUMoUwvWJisAzt2Q&flag_type=review&previous_url=https%3A%2F%2Fwww.yelp.com%2Fbiz%2Fintelligentsia-coffee-chicago-8%3Fstart%3D20,Report review,,,,,,,,,
https://www.yelp.com/user_details?userid=4wtZ1J5k5kHehruAQecP2g,https://s3-media2.fl.yelpcdn.com/assets/srv0/yelp_styleguide/514f6997a318/assets/img/default_avatars/user_60_square.png,Larry M.,"Wrentham, MA",friends,0,reviews,14,photos,[object Object],8,,,https://www.yelp.com/biz_share/kWOELNlUM14bv0m-slvq6A/review/eSBpFfLDMjXpBH70QD0TXA,[object Object],Share review,javascript:;,Embed review,https://www.yelp.com/thanx?complimentable_id=eSBpFfLDMjXpBH70QD0TXA&complimentable_type=REVIEW&previous_url=https%3A%2F%2Fwww.yelp.com%2Fbiz%2Fintelligentsia-coffee-chicago-8%3Fstart%3D20&user_id=4wtZ1J5k5kHehruAQecP2g,Compliment,https://www.yelp.com/mail?action_send_form=1&dst=4wtZ1J5k5kHehruAQecP2g&return_url=https%3A%2F%2Fwww.yelp.com%2Fbiz%2Fintelligentsia-coffee-chicago-8%3Fstart%3D20,Send message,https://www.yelp.com/following_user/add?dst_user_id=4wtZ1J5k5kHehruAQecP2g&previous_url=https://www.yelp.com/biz/intelligentsia-coffee-chicago-8?start=20,Follow Larry M.,https://www.yelp.com/following_user/remove?dst_user_id=4wtZ1J5k5kHehruAQecP2g&previous_url=https://www.yelp.com/biz/intelligentsia-coffee-chicago-8?start=20,Stop following Larry M.,https://s3-media2.fl.yelpcdn.com/assets/srv0/yelp_design_web/9b34e39ccbeb/assets/img/stars/stars.png,9/9/2018,"Visiting from out of state and we happened to walk by. Stopped in for a coffee and chai (really good). Cool place, great quality.",Was this review …?,Useful,,Funny,Cool,Others will see how you vote!,https://s3-media3.fl.yelpcdn.com/assets/srv0/yelp_deanonymize_ufc/f871a0ff7872/lib/img/200x120_ufc_globe.png,"Heads up: From now on, other Yelpers will be able to see how you voted. Want to chime in?","Yes, Let Me Vote!",Maybe Later,https://www.yelp.com/flag_content?biz_id=kWOELNlUM14bv0m-slvq6A&flag_id=eSBpFfLDMjXpBH70QD0TXA&flag_type=review&previous_url=https%3A%2F%2Fwww.yelp.com%2Fbiz%2Fintelligentsia-coffee-chicago-8%3Fstart%3D20,Report review,,,,,,,,,
https://www.yelp.com/user_details?userid=6BmnWHF3B1Jg8IUO9PjbpQ,https://s3-media3.fl.yelpcdn.com/photo/BPC6dFZfSyC3wwQLy7sl3A/60s.jpg,Elaine T.,"Detroit, MI",friends,3,reviews,35,photos,[object Object],55,,,https://www.yelp.com/biz_share/kWOELNlUM14bv0m-slvq6A/review/6NWfXwCp45LqyztwRIRl9w,[object Object],Share review,javascript:;,Embed review,https://www.yelp.com/thanx?complimentable_id=6NWfXwCp45LqyztwRIRl9w&complimentable_type=REVIEW&previous_url=https%3A%2F%2Fwww.yelp.com%2Fbiz%2Fintelligentsia-coffee-chicago-8%3Fstart%3D20&user_id=6BmnWHF3B1Jg8IUO9PjbpQ,Compliment,https://www.yelp.com/mail?action_send_form=1&dst=6BmnWHF3B1Jg8IUO9PjbpQ&return_url=https%3A%2F%2Fwww.yelp.com%2Fbiz%2Fintelligentsia-coffee-chicago-8%3Fstart%3D20,Send message,https://www.yelp.com/following_user/add?dst_user_id=6BmnWHF3B1Jg8IUO9PjbpQ&previous_url=https://www.yelp.com/biz/intelligentsia-coffee-chicago-8?start=20,Follow Elaine T.,https://www.yelp.com/following_user/remove?dst_user_id=6BmnWHF3B1Jg8IUO9PjbpQ&previous_url=https://www.yelp.com/biz/intelligentsia-coffee-chicago-8?start=20,Stop following Elaine T.,https://s3-media2.fl.yelpcdn.com/assets/srv0/yelp_design_web/9b34e39ccbeb/assets/img/stars/stars.png,12/10/2017,"The pour overs and espresso need no additional reviews - all has been said about how delicious they are - I had an oatmilk cappuccino. I must add that the rooibos tea was a surprisingly fantastic selection on a rainy, dreary evening. If you are looking for a non-caffeinated option, order the rooibos. Enjoy!",Was this review …?,Useful,,Funny,Cool,Others will see how you vote!,https://s3-media3.fl.yelpcdn.com/assets/srv0/yelp_deanonymize_ufc/f871a0ff7872/lib/img/200x120_ufc_globe.png,"Heads up: From now on, other Yelpers will be able to see how you voted. Want to chime in?","Yes, Let Me Vote!",Maybe Later,https://www.yelp.com/flag_content?biz_id=kWOELNlUM14bv0m-slvq6A&flag_id=6NWfXwCp45LqyztwRIRl9w&flag_type=review&previous_url=https%3A%2F%2Fwww.yelp.com%2Fbiz%2Fintelligentsia-coffee-chicago-8%3Fstart%3D20,Report review,,,,,,,,,
https://www.yelp.com/user_details?userid=eqc4mZjT-DuED0jSaXC1rQ,https://s3-media1.fl.yelpcdn.com/photo/dRam2Ia3NmaR3e8PtX4lyA/60s.jpg,Carly D.,"Saint Louis, MO",friends,38,reviews,712,photos,[object Object],21,Elite ’18,https://www.yelp.com/elite,https://www.yelp.com/biz_share/kWOELNlUM14bv0m-slvq6A/review/qo6gtcSy5BDfNTBTA_dhPQ,[object Object],Share review,javascript:;,Embed review,https://www.yelp.com/thanx?complimentable_id=qo6gtcSy5BDfNTBTA_dhPQ&complimentable_type=REVIEW&previous_url=https%3A%2F%2Fwww.yelp.com%2Fbiz%2Fintelligentsia-coffee-chicago-8%3Fstart%3D20&user_id=eqc4mZjT-DuED0jSaXC1rQ,Compliment,https://www.yelp.com/mail?action_send_form=1&dst=eqc4mZjT-DuED0jSaXC1rQ&return_url=https%3A%2F%2Fwww.yelp.com%2Fbiz%2Fintelligentsia-coffee-chicago-8%3Fstart%3D20,Send message,https://www.yelp.com/following_user/add?dst_user_id=eqc4mZjT-DuED0jSaXC1rQ&previous_url=https://www.yelp.com/biz/intelligentsia-coffee-chicago-8?start=20,Follow Carly D.,https://www.yelp.com/following_user/remove?dst_user_id=eqc4mZjT-DuED0jSaXC1rQ&previous_url=https://www.yelp.com/biz/intelligentsia-coffee-chicago-8?start=20,Stop following Carly D.,https://s3-media2.fl.yelpcdn.com/assets/srv0/yelp_design_web/9b34e39ccbeb/assets/img/stars/stars.png,10/18/2017,"Awesome coffee.  Had a soy latte.  So smooth, so strong.  So delicious.  The croissants with almond are quite delicious, too.  Well worth the price/the trek if you aren't nearby.  Just stock up on their bags of coffee!",Was this review …?,Useful,,Funny,Cool,Others will see how you vote!,https://s3-media3.fl.yelpcdn.com/assets/srv0/yelp_deanonymize_ufc/f871a0ff7872/lib/img/200x120_ufc_globe.png,"Heads up: From now on, other Yelpers will be able to see how you voted. Want to chime in?","Yes, Let Me Vote!",Maybe Later,https://www.yelp.com/flag_content?biz_id=kWOELNlUM14bv0m-slvq6A&flag_id=qo6gtcSy5BDfNTBTA_dhPQ&flag_type=review&previous_url=https%3A%2F%2Fwww.yelp.com%2Fbiz%2Fintelligentsia-coffee-chicago-8%3Fstart%3D20,Report review,,,,,2 check-ins,[object Object],,,
https://www.yelp.com/user_details?userid=8q6vJuhgs4e8jf5FkSMybA,https://s3-media2.fl.yelpcdn.com/assets/srv0/yelp_styleguide/514f6997a318/assets/img/default_avatars/user_60_square.png,Jin L.,"Manhattan, New York, NY",friends,0,review,1,,,,,,,,,,,,,,,,,,,,,,,,,,,,,,,,,,,,,,,,,,
https://www.yelp.com/user_details?userid=hUYO9PhYwvQ0xvAGZLmK4Q,https://s3-media4.fl.yelpcdn.com/photo/4VvsY4e7mbdfTY5E31PwVQ/60s.jpg,Yao L.,"Crawfordsville, IN",friends,44,reviews,4,photos,[object Object],11,,,https://www.yelp.com/biz_share/kWOELNlUM14bv0m-slvq6A/review/2yjvElqrXwPzWAezLkQjvg,[object Object],Share review,javascript:;,Embed review,https://www.yelp.com/thanx?complimentable_id=2yjvElqrXwPzWAezLkQjvg&complimentable_type=REVIEW&previous_url=https%3A%2F%2Fwww.yelp.com%2Fbiz%2Fintelligentsia-coffee-chicago-8%3Fstart%3D40&user_id=hUYO9PhYwvQ0xvAGZLmK4Q,Compliment,https://www.yelp.com/mail?action_send_form=1&dst=hUYO9PhYwvQ0xvAGZLmK4Q&return_url=https%3A%2F%2Fwww.yelp.com%2Fbiz%2Fintelligentsia-coffee-chicago-8%3Fstart%3D40,Send message,https://www.yelp.com/following_user/add?dst_user_id=hUYO9PhYwvQ0xvAGZLmK4Q&previous_url=https://www.yelp.com/biz/intelligentsia-coffee-chicago-8?start=40,Follow Yao L.,https://www.yelp.com/following_user/remove?dst_user_id=hUYO9PhYwvQ0xvAGZLmK4Q&previous_url=https://www.yelp.com/biz/intelligentsia-coffee-chicago-8?start=40,Stop following Yao L.,https://s3-media2.fl.yelpcdn.com/assets/srv0/yelp_design_web/9b34e39ccbeb/assets/img/stars/stars.png,3/7/2018,"Matcha latte almost makes me cry! As a big fan of the real coffee and tea, I was fed up with the Starbucks style super sweet something. And here I am! Love it, love it, love it! Takes me back to Kyoto!",voted for this review,Useful,1,Funny,Cool,Others will see how you vote!,https://s3-media3.fl.yelpcdn.com/assets/srv0/yelp_deanonymize_ufc/f871a0ff7872/lib/img/200x120_ufc_globe.png,"Heads up: From now on, other Yelpers will be able to see how you voted. Want to chime in?","Yes, Let Me Vote!",Maybe Later,https://www.yelp.com/flag_content?biz_id=kWOELNlUM14bv0m-slvq6A&flag_id=2yjvElqrXwPzWAezLkQjvg&flag_type=review&previous_url=https%3A%2F%2Fwww.yelp.com%2Fbiz%2Fintelligentsia-coffee-chicago-8%3Fstart%3D40,Report review,,,,,1 check-in,[object Object],,1,
