js-analytics-click href,photo-box-img src,user-display-name,user-location,friend-count,friend-count 2,review-count,review-count 2,photo-count,icon_svg href 3,photo-count 2,is-elite,is-elite href,arrange href,icon_svg href 4,action-link_label,arrange href 2,action-link_label 2,arrange href 3,action-link_label 3,arrange href 4,action-link_label 4,arrange href 5,action-link_label 5,arrange href 6,action-link_label 6,offscreen src,rating-qualifier,review-content,voting-intro,vote-type,count,vote-type 2,vote-type 3,u-space-b3,u-space-b3 src,u-space-b2,ybtn,js-maybe-later-button,chiclet-link href,tooltip,photo-box-img src 2,biz-shim href,photo-box-img src 3,biz-shim href 2,review-tags_item,icon_svg href 14,count 2,count 3,photo-box-overlay_caption
https://www.yelp.com/user_details?userid=Izuxj-5CjJQyp9-qMWcOxg,https://s3-media3.fl.yelpcdn.com/photo/23j-AM-0doaZjFrvBhC5-A/60s.jpg,John O.,"Ruskin, FL",friend,1,reviews,7,photos,[object Object],2,,,https://www.yelp.com/biz_share/kWOELNlUM14bv0m-slvq6A/review/fAepeL-9J506pdJ169y8wA,[object Object],Share review,javascript:;,Embed review,https://www.yelp.com/thanx?complimentable_id=fAepeL-9J506pdJ169y8wA&complimentable_type=REVIEW&previous_url=https%3A%2F%2Fwww.yelp.com%2Fbiz%2Fintelligentsia-coffee-chicago-8%3Fstart%3D60&user_id=Izuxj-5CjJQyp9-qMWcOxg,Compliment,https://www.yelp.com/mail?action_send_form=1&dst=Izuxj-5CjJQyp9-qMWcOxg&return_url=https%3A%2F%2Fwww.yelp.com%2Fbiz%2Fintelligentsia-coffee-chicago-8%3Fstart%3D60,Send message,https://www.yelp.com/following_user/add?dst_user_id=Izuxj-5CjJQyp9-qMWcOxg&previous_url=https://www.yelp.com/biz/intelligentsia-coffee-chicago-8?start=60,Follow John O.,https://www.yelp.com/following_user/remove?dst_user_id=Izuxj-5CjJQyp9-qMWcOxg&previous_url=https://www.yelp.com/biz/intelligentsia-coffee-chicago-8?start=60,Stop following John O.,https://s3-media2.fl.yelpcdn.com/assets/srv0/yelp_design_web/9b34e39ccbeb/assets/img/stars/stars.png,2/23/2018,Stopped here on a recent trip and ordered a black coffee.  The staff was friendly and the coffee was delicious.  It has a little something extra to it.  I would definitely go back!,Was this review …?,Useful,,Funny,Cool,Others will see how you vote!,https://s3-media3.fl.yelpcdn.com/assets/srv0/yelp_deanonymize_ufc/f871a0ff7872/lib/img/200x120_ufc_globe.png,"Heads up: From now on, other Yelpers will be able to see how you voted. Want to chime in?","Yes, Let Me Vote!",Maybe Later,https://www.yelp.com/flag_content?biz_id=kWOELNlUM14bv0m-slvq6A&flag_id=fAepeL-9J506pdJ169y8wA&flag_type=review&previous_url=https%3A%2F%2Fwww.yelp.com%2Fbiz%2Fintelligentsia-coffee-chicago-8%3Fstart%3D60,Report review,,,,,,,,,
https://www.yelp.com/user_details?userid=RiYSqh2E0LTyYvS3xufbGA,https://s3-media3.fl.yelpcdn.com/photo/s9RtLoYGEqRrFaWa98BA2A/60s.jpg,Bruce H.,"Manhattan, NY",friend,1,reviews,42,photos,[object Object],37,,,https://www.yelp.com/biz_share/kWOELNlUM14bv0m-slvq6A/review/yFc6jr67DhvPxKm4rYfGuA,[object Object],Share review,javascript:;,Embed review,https://www.yelp.com/thanx?complimentable_id=yFc6jr67DhvPxKm4rYfGuA&complimentable_type=REVIEW&previous_url=https%3A%2F%2Fwww.yelp.com%2Fbiz%2Fintelligentsia-coffee-chicago-8%3Fstart%3D60&user_id=RiYSqh2E0LTyYvS3xufbGA,Compliment,https://www.yelp.com/mail?action_send_form=1&dst=RiYSqh2E0LTyYvS3xufbGA&return_url=https%3A%2F%2Fwww.yelp.com%2Fbiz%2Fintelligentsia-coffee-chicago-8%3Fstart%3D60,Send message,https://www.yelp.com/following_user/add?dst_user_id=RiYSqh2E0LTyYvS3xufbGA&previous_url=https://www.yelp.com/biz/intelligentsia-coffee-chicago-8?start=60,Follow Bruce H.,https://www.yelp.com/following_user/remove?dst_user_id=RiYSqh2E0LTyYvS3xufbGA&previous_url=https://www.yelp.com/biz/intelligentsia-coffee-chicago-8?start=60,Stop following Bruce H.,https://s3-media2.fl.yelpcdn.com/assets/srv0/yelp_design_web/9b34e39ccbeb/assets/img/stars/stars.png,2/4/2017,"I have traveled a lot, and I have to say this is probably one of the best coffee spots I've visited in Chicago. Try the unique #Chemex.With success comes popularity, so be prepared to wait.",Was this review …?,Useful,,Funny,Cool,Others will see how you vote!,https://s3-media3.fl.yelpcdn.com/assets/srv0/yelp_deanonymize_ufc/f871a0ff7872/lib/img/200x120_ufc_globe.png,"Heads up: From now on, other Yelpers will be able to see how you voted. Want to chime in?","Yes, Let Me Vote!",Maybe Later,https://www.yelp.com/flag_content?biz_id=kWOELNlUM14bv0m-slvq6A&flag_id=yFc6jr67DhvPxKm4rYfGuA&flag_type=review&previous_url=https%3A%2F%2Fwww.yelp.com%2Fbiz%2Fintelligentsia-coffee-chicago-8%3Fstart%3D60,Report review,https://s3-media2.fl.yelpcdn.com/bphoto/XYQL3dZwWu9OJk84ygeFFg/348s.jpg,https://www.yelp.com/biz_photos/intelligentsia-coffee-chicago-8?reviewid=yFc6jr67DhvPxKm4rYfGuA&select=XYQL3dZwWu9OJk84ygeFFg,,,,,,,
https://www.yelp.com/user_details?userid=wXNvvrY-to1k8uD1O2HR7A,https://s3-media2.fl.yelpcdn.com/photo/1-La7ODgT-Fjb7R-4c6Efg/60s.jpg,Matt K.,"Gurnee, IL",friends,0,reviews,38,photos,[object Object],5,,,https://www.yelp.com/biz_share/kWOELNlUM14bv0m-slvq6A/review/2SFcx3rmdAcValSoBdLZ4g,[object Object],Share review,javascript:;,Embed review,https://www.yelp.com/thanx?complimentable_id=2SFcx3rmdAcValSoBdLZ4g&complimentable_type=REVIEW&previous_url=https%3A%2F%2Fwww.yelp.com%2Fbiz%2Fintelligentsia-coffee-chicago-8%3Fstart%3D60&user_id=wXNvvrY-to1k8uD1O2HR7A,Compliment,https://www.yelp.com/mail?action_send_form=1&dst=wXNvvrY-to1k8uD1O2HR7A&return_url=https%3A%2F%2Fwww.yelp.com%2Fbiz%2Fintelligentsia-coffee-chicago-8%3Fstart%3D60,Send message,https://www.yelp.com/following_user/add?dst_user_id=wXNvvrY-to1k8uD1O2HR7A&previous_url=https://www.yelp.com/biz/intelligentsia-coffee-chicago-8?start=60,Follow Matt K.,https://www.yelp.com/following_user/remove?dst_user_id=wXNvvrY-to1k8uD1O2HR7A&previous_url=https://www.yelp.com/biz/intelligentsia-coffee-chicago-8?start=60,Stop following Matt K.,https://s3-media2.fl.yelpcdn.com/assets/srv0/yelp_design_web/9b34e39ccbeb/assets/img/stars/stars.png,10/28/2017,"Surprisingly affordable prices for a hip place like this in downtown. I had a cappuccino that was well prepared, in a nice mug that went down smooth.  A pleasant break from the monotony of Starbucks. Well done",voted for this review,Useful,1,Funny,Cool,Others will see how you vote!,https://s3-media3.fl.yelpcdn.com/assets/srv0/yelp_deanonymize_ufc/f871a0ff7872/lib/img/200x120_ufc_globe.png,"Heads up: From now on, other Yelpers will be able to see how you voted. Want to chime in?","Yes, Let Me Vote!",Maybe Later,https://www.yelp.com/flag_content?biz_id=kWOELNlUM14bv0m-slvq6A&flag_id=2SFcx3rmdAcValSoBdLZ4g&flag_type=review&previous_url=https%3A%2F%2Fwww.yelp.com%2Fbiz%2Fintelligentsia-coffee-chicago-8%3Fstart%3D60,Report review,,,,,1 check-in,[object Object],,,
https://www.yelp.com/user_details?userid=rQLEfpfSjVK-3dBmIMKZDA,https://s3-media3.fl.yelpcdn.com/photo/rR2hvEJm4Vzb3ShTbwpKfg/60s.jpg,Luke L.,"San Gabriel, CA",friends,22,reviews,1448,photos,[object Object],9722,Elite ’18,https://www.yelp.com/elite,https://www.yelp.com/biz_share/kWOELNlUM14bv0m-slvq6A/review/zLyhRJ1iCwSW8HsTyyddJA,[object Object],Share review,javascript:;,Embed review,https://www.yelp.com/thanx?complimentable_id=zLyhRJ1iCwSW8HsTyyddJA&complimentable_type=REVIEW&previous_url=https%3A%2F%2Fwww.yelp.com%2Fbiz%2Fintelligentsia-coffee-chicago-8%3Fstart%3D60&user_id=rQLEfpfSjVK-3dBmIMKZDA,Compliment,https://www.yelp.com/mail?action_send_form=1&dst=rQLEfpfSjVK-3dBmIMKZDA&return_url=https%3A%2F%2Fwww.yelp.com%2Fbiz%2Fintelligentsia-coffee-chicago-8%3Fstart%3D60,Send message,https://www.yelp.com/following_user/add?dst_user_id=rQLEfpfSjVK-3dBmIMKZDA&previous_url=https://www.yelp.com/biz/intelligentsia-coffee-chicago-8?start=60,Follow Luke L.,https://www.yelp.com/following_user/remove?dst_user_id=rQLEfpfSjVK-3dBmIMKZDA&previous_url=https://www.yelp.com/biz/intelligentsia-coffee-chicago-8?start=60,Stop following Luke L.,https://s3-media2.fl.yelpcdn.com/assets/srv0/yelp_design_web/9b34e39ccbeb/assets/img/stars/stars.png,10/14/2015,"I finally had an opportunity to try Intelligentsia Coffee at their place of origin - Chicago. This is one of the six Chicago locations (as of October 2015) and it is also conveniently located right next to the Millennium Park. I've visited Intelligentsia Coffee once before (in Pasadena, CA) and their Black Cat Organic Latte was really good; however, I wanted to try something else and I decided to stick with the ONLY available cold coffee drink on the menu - cold brewed coffee.***Cold Brewed Iced Coffee + Almond Croissant: Cold brewed iced coffee tasted slightly acidic (sour), but it wasn't overwhelming enough to interfere with the overall flavors. Almond croissant tasted pretty good, but nothing too spectacular.***Hey Intelligentsia Coffee is Chicago's signature coffee shop, so you should definitely give it a try. P.S. - Intelligentsia also offers public roasting works tours once a month for $30 per person ().",2 people voted for this review,Useful,,Funny,Cool,Others will see how you vote!,https://s3-media3.fl.yelpcdn.com/assets/srv0/yelp_deanonymize_ufc/f871a0ff7872/lib/img/200x120_ufc_globe.png,"Heads up: From now on, other Yelpers will be able to see how you voted. Want to chime in?","Yes, Let Me Vote!",Maybe Later,https://www.yelp.com/flag_content?biz_id=kWOELNlUM14bv0m-slvq6A&flag_id=zLyhRJ1iCwSW8HsTyyddJA&flag_type=review&previous_url=https%3A%2F%2Fwww.yelp.com%2Fbiz%2Fintelligentsia-coffee-chicago-8%3Fstart%3D60,Report review,https://s3-media1.fl.yelpcdn.com/bphoto/-pnh5gOn2Ia3vgSXD0IovA/348s.jpg,https://www.yelp.com/biz_photos/intelligentsia-coffee-chicago-8?reviewid=zLyhRJ1iCwSW8HsTyyddJA&select=-pnh5gOn2Ia3vgSXD0IovA,,,1 check-in,[object Object],1,1,Cold Brewed Iced Coffee + Almond Croissant
https://www.yelp.com/user_details?userid=YJblj_SdFVw8_QvEVo_kag,https://s3-media2.fl.yelpcdn.com/photo/6-SYtThVAL6OfAAiTpH0Qw/60s.jpg,Noah P.,"Atlanta, GA",friend,1,reviews,30,photos,[object Object],185,,,https://www.yelp.com/biz_share/kWOELNlUM14bv0m-slvq6A/review/CW9DrNXPRRhuVwQlDKUECg,[object Object],Share review,javascript:;,Embed review,https://www.yelp.com/thanx?complimentable_id=CW9DrNXPRRhuVwQlDKUECg&complimentable_type=REVIEW&previous_url=https%3A%2F%2Fwww.yelp.com%2Fbiz%2Fintelligentsia-coffee-chicago-8%3Fstart%3D60&user_id=YJblj_SdFVw8_QvEVo_kag,Compliment,https://www.yelp.com/mail?action_send_form=1&dst=YJblj_SdFVw8_QvEVo_kag&return_url=https%3A%2F%2Fwww.yelp.com%2Fbiz%2Fintelligentsia-coffee-chicago-8%3Fstart%3D60,Send message,https://www.yelp.com/following_user/add?dst_user_id=YJblj_SdFVw8_QvEVo_kag&previous_url=https://www.yelp.com/biz/intelligentsia-coffee-chicago-8?start=60,Follow Noah P.,https://www.yelp.com/following_user/remove?dst_user_id=YJblj_SdFVw8_QvEVo_kag&previous_url=https://www.yelp.com/biz/intelligentsia-coffee-chicago-8?start=60,Stop following Noah P.,https://s3-media2.fl.yelpcdn.com/assets/srv0/yelp_design_web/9b34e39ccbeb/assets/img/stars/stars.png,11/4/2016,"Intelligenista is the perfect place for a splendid cup of coffee for your morning. Having a lively and hippy atmosphere, this coffee shop is designed to make you feel relaxed but at the same time, productive. Their latte art is extremely on point - delicate and clean. The latte itself is foamy, creamy and has just the right amount of sweetness enhancement. What we found behind each cup of coffee is the coffee bean served here has been roasted locally. That is the most important thing which gives the taste of Intelligenista's coffee strong, fresh, robust yet extremely fragrant. The unique flavor remains in every sip, which is impressive. When you walk in here, you're in for a treat. They also have a small variation of pastry in case you crave something simple for breakfast.Recommended : Mocha Cappuccino, Almond Croissants, Vanilla LatteFor more, visit us at:",1 person voted for this review,Useful,,Funny,Cool,Others will see how you vote!,https://s3-media3.fl.yelpcdn.com/assets/srv0/yelp_deanonymize_ufc/f871a0ff7872/lib/img/200x120_ufc_globe.png,"Heads up: From now on, other Yelpers will be able to see how you voted. Want to chime in?","Yes, Let Me Vote!",Maybe Later,https://www.yelp.com/flag_content?biz_id=kWOELNlUM14bv0m-slvq6A&flag_id=CW9DrNXPRRhuVwQlDKUECg&flag_type=review&previous_url=https%3A%2F%2Fwww.yelp.com%2Fbiz%2Fintelligentsia-coffee-chicago-8%3Fstart%3D60,Report review,https://s3-media2.fl.yelpcdn.com/bphoto/UHFlhuAiGgK3ZBMZCxrqQg/348s.jpg,https://www.yelp.com/biz_photos/intelligentsia-coffee-chicago-8?reviewid=CW9DrNXPRRhuVwQlDKUECg&select=UHFlhuAiGgK3ZBMZCxrqQg,https://s3-media2.fl.yelpcdn.com/bphoto/XWN6oLc4zAZuyywYOtsbCg/168s.jpg,https://www.yelp.com/biz_photos/intelligentsia-coffee-chicago-8?reviewid=CW9DrNXPRRhuVwQlDKUECg&select=XWN6oLc4zAZuyywYOtsbCg,,,1,,Tea shelf
https://www.yelp.com/user_details?userid=HPyZ_STe3lsXdP3guAUzOg,https://s3-media4.fl.yelpcdn.com/photo/EA6AFJQF-qc9kv5LSY9Kcw/60s.jpg,Joe G.,"Torrance, CA",friends,101,reviews,263,photos,[object Object],264,Elite ’18,https://www.yelp.com/elite,https://www.yelp.com/biz_share/kWOELNlUM14bv0m-slvq6A/review/QwpxIyHachAVK78UrGqWuQ,[object Object],Share review,javascript:;,Embed review,https://www.yelp.com/thanx?complimentable_id=QwpxIyHachAVK78UrGqWuQ&complimentable_type=REVIEW&previous_url=https%3A%2F%2Fwww.yelp.com%2Fbiz%2Fintelligentsia-coffee-chicago-8%3Fstart%3D60&user_id=HPyZ_STe3lsXdP3guAUzOg,Compliment,https://www.yelp.com/mail?action_send_form=1&dst=HPyZ_STe3lsXdP3guAUzOg&return_url=https%3A%2F%2Fwww.yelp.com%2Fbiz%2Fintelligentsia-coffee-chicago-8%3Fstart%3D60,Send message,https://www.yelp.com/following_user/add?dst_user_id=HPyZ_STe3lsXdP3guAUzOg&previous_url=https://www.yelp.com/biz/intelligentsia-coffee-chicago-8?start=60,Follow Joe G.,https://www.yelp.com/following_user/remove?dst_user_id=HPyZ_STe3lsXdP3guAUzOg&previous_url=https://www.yelp.com/biz/intelligentsia-coffee-chicago-8?start=60,Stop following Joe G.,https://s3-media2.fl.yelpcdn.com/assets/srv0/yelp_design_web/9b34e39ccbeb/assets/img/stars/stars.png,10/24/2016,"I know that Intelligentsia Coffee isn't exclusive to Chicago, but I like to think it is since it originated there.  Whenever I visit Chicago, I try to grab a cup of coffee from here.  The coffee is strong but quality.  Also, the coffee shop is nearby many attractions like Millennium Park, The Bean, and the Chicago Art Museum.  Try their iced coffees and lattes if you can, they're very strong and tasty.  It'll go straight to your brain!overall: great coffee spot in Chicago",Was this review …?,Useful,,Funny,Cool,Others will see how you vote!,https://s3-media3.fl.yelpcdn.com/assets/srv0/yelp_deanonymize_ufc/f871a0ff7872/lib/img/200x120_ufc_globe.png,"Heads up: From now on, other Yelpers will be able to see how you voted. Want to chime in?","Yes, Let Me Vote!",Maybe Later,https://www.yelp.com/flag_content?biz_id=kWOELNlUM14bv0m-slvq6A&flag_id=QwpxIyHachAVK78UrGqWuQ&flag_type=review&previous_url=https%3A%2F%2Fwww.yelp.com%2Fbiz%2Fintelligentsia-coffee-chicago-8%3Fstart%3D60,Report review,,,,,2 check-ins,[object Object],,,
https://www.yelp.com/user_details?userid=8_Onb2TWeMR1TdGjcqiIcg,https://s3-media4.fl.yelpcdn.com/photo/u8cSutlFnxyN2GEyG7s44g/60s.jpg,Ryan B.,"Brookline, MA",friends,102,reviews,170,photos,[object Object],70,Elite ’18,https://www.yelp.com/elite,https://www.yelp.com/biz_share/kWOELNlUM14bv0m-slvq6A/review/qYZF7oyZVRuZlM8HH6cNRw,[object Object],Share review,javascript:;,Embed review,https://www.yelp.com/thanx?complimentable_id=qYZF7oyZVRuZlM8HH6cNRw&complimentable_type=REVIEW&previous_url=https%3A%2F%2Fwww.yelp.com%2Fbiz%2Fintelligentsia-coffee-chicago-8%3Fstart%3D60&user_id=8_Onb2TWeMR1TdGjcqiIcg,Compliment,https://www.yelp.com/mail?action_send_form=1&dst=8_Onb2TWeMR1TdGjcqiIcg&return_url=https%3A%2F%2Fwww.yelp.com%2Fbiz%2Fintelligentsia-coffee-chicago-8%3Fstart%3D60,Send message,https://www.yelp.com/following_user/add?dst_user_id=8_Onb2TWeMR1TdGjcqiIcg&previous_url=https://www.yelp.com/biz/intelligentsia-coffee-chicago-8?start=60,Follow Ryan B.,https://www.yelp.com/following_user/remove?dst_user_id=8_Onb2TWeMR1TdGjcqiIcg&previous_url=https://www.yelp.com/biz/intelligentsia-coffee-chicago-8?start=60,Stop following Ryan B.,https://s3-media2.fl.yelpcdn.com/assets/srv0/yelp_design_web/9b34e39ccbeb/assets/img/stars/stars.png,5/6/2017,Came here while on a business trip for a conference at the McCormick. After trying a sample I ordered the cold brew carbonated turmeric tonic. It was refreshing and settled down my traveler's belly. The staff even moved a table for me so I could recharge my cell phone.,Was this review …?,Useful,,Funny,Cool,Others will see how you vote!,https://s3-media3.fl.yelpcdn.com/assets/srv0/yelp_deanonymize_ufc/f871a0ff7872/lib/img/200x120_ufc_globe.png,"Heads up: From now on, other Yelpers will be able to see how you voted. Want to chime in?","Yes, Let Me Vote!",Maybe Later,https://www.yelp.com/flag_content?biz_id=kWOELNlUM14bv0m-slvq6A&flag_id=qYZF7oyZVRuZlM8HH6cNRw&flag_type=review&previous_url=https%3A%2F%2Fwww.yelp.com%2Fbiz%2Fintelligentsia-coffee-chicago-8%3Fstart%3D60,Report review,,,,,1 check-in,[object Object],,,
https://www.yelp.com/user_details?userid=TwCXV8ysdtRMEBU1gsOdUA,https://s3-media2.fl.yelpcdn.com/photo/5ysimbnGpRKVKRKzaMubEg/60s.jpg,Allison C.,"Durham, NC",friends,22,reviews,207,photos,[object Object],454,Elite ’18,https://www.yelp.com/elite,https://www.yelp.com/biz_share/kWOELNlUM14bv0m-slvq6A/review/1kslwkEhX6WjA6jxeBF8BQ,[object Object],Share review,javascript:;,Embed review,https://www.yelp.com/thanx?complimentable_id=1kslwkEhX6WjA6jxeBF8BQ&complimentable_type=REVIEW&previous_url=https%3A%2F%2Fwww.yelp.com%2Fbiz%2Fintelligentsia-coffee-chicago-8%3Fstart%3D60&user_id=TwCXV8ysdtRMEBU1gsOdUA,Compliment,https://www.yelp.com/mail?action_send_form=1&dst=TwCXV8ysdtRMEBU1gsOdUA&return_url=https%3A%2F%2Fwww.yelp.com%2Fbiz%2Fintelligentsia-coffee-chicago-8%3Fstart%3D60,Send message,https://www.yelp.com/following_user/add?dst_user_id=TwCXV8ysdtRMEBU1gsOdUA&previous_url=https://www.yelp.com/biz/intelligentsia-coffee-chicago-8?start=60,Follow Allison C.,https://www.yelp.com/following_user/remove?dst_user_id=TwCXV8ysdtRMEBU1gsOdUA&previous_url=https://www.yelp.com/biz/intelligentsia-coffee-chicago-8?start=60,Stop following Allison C.,https://s3-media2.fl.yelpcdn.com/assets/srv0/yelp_design_web/9b34e39ccbeb/assets/img/stars/stars.png,10/11/2016,"I almost feel like I wasted my order here since I only got a plain ole drip coffee and an oatmeal chocolate chip walnut cookie. But, no regrets! It was an amazing cup (actually more, since they serve it you in a mug + a tiny pitcher on a tray) of coffee with a mellow flavor. The cookie was moist and full of chocolate chips. Which is the only way I like my oatmeal cookies. I spent some time inside catching up on work, and it was constantly buzzing with activity, even up until an hour of closing. If I lived in this city, I would definitely come back and try everything on the menu!",Was this review …?,Useful,,Funny,Cool,Others will see how you vote!,https://s3-media3.fl.yelpcdn.com/assets/srv0/yelp_deanonymize_ufc/f871a0ff7872/lib/img/200x120_ufc_globe.png,"Heads up: From now on, other Yelpers will be able to see how you voted. Want to chime in?","Yes, Let Me Vote!",Maybe Later,https://www.yelp.com/flag_content?biz_id=kWOELNlUM14bv0m-slvq6A&flag_id=1kslwkEhX6WjA6jxeBF8BQ&flag_type=review&previous_url=https%3A%2F%2Fwww.yelp.com%2Fbiz%2Fintelligentsia-coffee-chicago-8%3Fstart%3D60,Report review,https://s3-media3.fl.yelpcdn.com/bphoto/4W5WwnF937FFUqD8CsGIXg/348s.jpg,https://www.yelp.com/biz_photos/intelligentsia-coffee-chicago-8?reviewid=1kslwkEhX6WjA6jxeBF8BQ&select=4W5WwnF937FFUqD8CsGIXg,,,,,,,regular drip coffee and an oatmeal chocolate chip walnut cookie
https://www.yelp.com/user_details?userid=dYg_GS6bslNJN0IpMc9-vQ,https://s3-media2.fl.yelpcdn.com/assets/srv0/yelp_styleguide/514f6997a318/assets/img/default_avatars/user_60_square.png,Niki C.,"Hicksville, NY",friends,0,reviews,21,photos,[object Object],21,,,https://www.yelp.com/biz_share/kWOELNlUM14bv0m-slvq6A/review/AGFqbaqssmvothNFPQFnSg,[object Object],Share review,javascript:;,Embed review,https://www.yelp.com/thanx?complimentable_id=AGFqbaqssmvothNFPQFnSg&complimentable_type=REVIEW&previous_url=https%3A%2F%2Fwww.yelp.com%2Fbiz%2Fintelligentsia-coffee-chicago-8%3Fstart%3D60&user_id=dYg_GS6bslNJN0IpMc9-vQ,Compliment,https://www.yelp.com/mail?action_send_form=1&dst=dYg_GS6bslNJN0IpMc9-vQ&return_url=https%3A%2F%2Fwww.yelp.com%2Fbiz%2Fintelligentsia-coffee-chicago-8%3Fstart%3D60,Send message,https://www.yelp.com/following_user/add?dst_user_id=dYg_GS6bslNJN0IpMc9-vQ&previous_url=https://www.yelp.com/biz/intelligentsia-coffee-chicago-8?start=60,Follow Niki C.,https://www.yelp.com/following_user/remove?dst_user_id=dYg_GS6bslNJN0IpMc9-vQ&previous_url=https://www.yelp.com/biz/intelligentsia-coffee-chicago-8?start=60,Stop following Niki C.,https://s3-media2.fl.yelpcdn.com/assets/srv0/yelp_design_web/9b34e39ccbeb/assets/img/stars/stars.png,12/28/2017,"Very clean. Decent coffee. I had the Almond Croissant and it's by far the best Almond croissant I've ever had. Even if you don't like coffee, come for a pastry.",Was this review …?,Useful,,Funny,Cool,Others will see how you vote!,https://s3-media3.fl.yelpcdn.com/assets/srv0/yelp_deanonymize_ufc/f871a0ff7872/lib/img/200x120_ufc_globe.png,"Heads up: From now on, other Yelpers will be able to see how you voted. Want to chime in?","Yes, Let Me Vote!",Maybe Later,https://www.yelp.com/flag_content?biz_id=kWOELNlUM14bv0m-slvq6A&flag_id=AGFqbaqssmvothNFPQFnSg&flag_type=review&previous_url=https%3A%2F%2Fwww.yelp.com%2Fbiz%2Fintelligentsia-coffee-chicago-8%3Fstart%3D60,Report review,https://s3-media4.fl.yelpcdn.com/bphoto/xCt7oHy8wisfJCkIOkl7gQ/348s.jpg,https://www.yelp.com/biz_photos/intelligentsia-coffee-chicago-8?reviewid=AGFqbaqssmvothNFPQFnSg&select=xCt7oHy8wisfJCkIOkl7gQ,,,,,,,
https://www.yelp.com/user_details?userid=K4ZeG8WAPfTS1AjD5GoJTw,https://s3-media2.fl.yelpcdn.com/photo/tMtSfQ_Xzis3sAxeh2hLwg/60s.jpg,Tzeko M.,"Singapore, Singapore",friends,238,reviews,115,photos,[object Object],4119,Elite ’18,https://www.yelp.com/elite,https://www.yelp.com/biz_share/kWOELNlUM14bv0m-slvq6A/review/J86Bad49LMJKrlaTpGHCUA,[object Object],Share review,javascript:;,Embed review,https://www.yelp.com/thanx?complimentable_id=J86Bad49LMJKrlaTpGHCUA&complimentable_type=REVIEW&previous_url=https%3A%2F%2Fwww.yelp.com%2Fbiz%2Fintelligentsia-coffee-chicago-8%3Fstart%3D60&user_id=K4ZeG8WAPfTS1AjD5GoJTw,Compliment,https://www.yelp.com/mail?action_send_form=1&dst=K4ZeG8WAPfTS1AjD5GoJTw&return_url=https%3A%2F%2Fwww.yelp.com%2Fbiz%2Fintelligentsia-coffee-chicago-8%3Fstart%3D60,Send message,https://www.yelp.com/following_user/add?dst_user_id=K4ZeG8WAPfTS1AjD5GoJTw&previous_url=https://www.yelp.com/biz/intelligentsia-coffee-chicago-8?start=60,Follow Tzeko M.,https://www.yelp.com/following_user/remove?dst_user_id=K4ZeG8WAPfTS1AjD5GoJTw&previous_url=https://www.yelp.com/biz/intelligentsia-coffee-chicago-8?start=60,Stop following Tzeko M.,https://s3-media2.fl.yelpcdn.com/assets/srv0/yelp_design_web/9b34e39ccbeb/assets/img/stars/stars.png,5/10/2015,"I never expect to find good coffee in Chicago, to be honest. Chicago is never known for its coffee as compared to Seattle, Portland or San Francisco but Intelligentsia Coffee was pretty impressive. I came here for 2 consecutive mornings for breakfast since it's less than 50 meters from my airbnb apartment on East Washington Street. Had latte on the first morning and soy chai latte the second day. Both were smooth and not acidic at all. What makes Intelligentsia coffee shines is their pastry from Floriole bakery. I tried a couple and chocolate almond croissant was my favorite. The Pain au chocolate and butter croissant were good too. Besides coffee, they have an impressive list of teas available and wished I have more days in the city to try them. Sparkling tea on tap. How cool is that? The space is beautiful and very hipster. The baristas do dressed up in suit with tie or bow. Don't get too intimidated with their dressing, they are all very friendly and could recommend some blend if you're not familiar or first timer to their coffee. Morning crowd consist of office workers as well as those who came back after a good workout in the city. If you're cycling, just drag your bicycle in with you!",2 people voted for this review,Useful,2,Funny,Cool,Others will see how you vote!,https://s3-media3.fl.yelpcdn.com/assets/srv0/yelp_deanonymize_ufc/f871a0ff7872/lib/img/200x120_ufc_globe.png,"Heads up: From now on, other Yelpers will be able to see how you voted. Want to chime in?","Yes, Let Me Vote!",Maybe Later,https://www.yelp.com/flag_content?biz_id=kWOELNlUM14bv0m-slvq6A&flag_id=J86Bad49LMJKrlaTpGHCUA&flag_type=review&previous_url=https%3A%2F%2Fwww.yelp.com%2Fbiz%2Fintelligentsia-coffee-chicago-8%3Fstart%3D60,Report review,https://s3-media4.fl.yelpcdn.com/bphoto/8ApoR16YWnAVeGtVTo2Lmw/348s.jpg,https://www.yelp.com/biz_photos/intelligentsia-coffee-chicago-8?reviewid=J86Bad49LMJKrlaTpGHCUA&select=8ApoR16YWnAVeGtVTo2Lmw,https://s3-media3.fl.yelpcdn.com/bphoto/626nMtCatpbitNOFLobw0Q/168s.jpg,https://www.yelp.com/biz_photos/intelligentsia-coffee-chicago-8?reviewid=J86Bad49LMJKrlaTpGHCUA&select=626nMtCatpbitNOFLobw0Q,2 check-ins,[object Object],,,That famous almond choc croissant from floire bakery and a latte
