js-analytics-click href,photo-box-img src,user-display-name,user-location,friend-count,friend-count 2,review-count,review-count 2,photo-count,icon_svg href 3,photo-count 2,arrange href,icon_svg href 4,action-link_label,arrange href 2,action-link_label 2,arrange href 3,action-link_label 3,arrange href 4,action-link_label 4,arrange href 5,action-link_label 5,arrange href 6,action-link_label 6,offscreen src,rating-qualifier,review-content,photo-box-img src 2,biz-shim href,voting-intro,vote-type,vote-type 2,vote-type 3,u-space-b3,u-space-b3 src,u-space-b2,ybtn,js-maybe-later-button,chiclet-link href,tooltip,count,count 2,review-tags_item,icon_svg href 14,count 3
https://www.yelp.com/user_details?userid=zuKR4B3CdrnA4HpqFvaVJQ,https://s3-media4.fl.yelpcdn.com/photo/DNskUYkpNPEc8-NBubynUg/60s.jpg,Chris R.,"Chicago, IL",friends,329,reviews,108,photos,[object Object],433,https://www.yelp.com/biz_share/GwQ88sbGm7K1Dnx_qgmt8Q/review/K5kWJ4L4eZ91cVoS9HJu5Q,[object Object],Share review,javascript:;,Embed review,https://www.yelp.com/thanx?complimentable_id=K5kWJ4L4eZ91cVoS9HJu5Q&complimentable_type=REVIEW&previous_url=https%3A%2F%2Fwww.yelp.com%2Fbiz%2Fcharmers-cafe-chicago-4%3Fosq%3Dcafe&user_id=zuKR4B3CdrnA4HpqFvaVJQ,Compliment,https://www.yelp.com/mail?action_send_form=1&dst=zuKR4B3CdrnA4HpqFvaVJQ&return_url=https%3A%2F%2Fwww.yelp.com%2Fbiz%2Fcharmers-cafe-chicago-4%3Fosq%3Dcafe,Send message,https://www.yelp.com/following_user/add?dst_user_id=zuKR4B3CdrnA4HpqFvaVJQ&previous_url=https://www.yelp.com/biz/charmers-cafe-chicago-4?osq=cafe,Follow Chris R.,https://www.yelp.com/following_user/remove?dst_user_id=zuKR4B3CdrnA4HpqFvaVJQ&previous_url=https://www.yelp.com/biz/charmers-cafe-chicago-4?osq=cafe,Stop following Chris R.,https://s3-media2.fl.yelpcdn.com/assets/srv0/yelp_design_web/9b34e39ccbeb/assets/img/stars/stars.png,4/20/2017,Charmers now does have a choice of 3 panini sandwiches and a breakfast sandwich. Grilled cheese was simple but well done. Good quality bread.,https://s3-media4.fl.yelpcdn.com/bphoto/0xeorcOJ4ekYwEV3TQJVUg/348s.jpg,https://www.yelp.com/biz_photos/charmers-cafe-chicago-4?reviewid=V281AsZC2an2_mFCva9Qzw&select=0xeorcOJ4ekYwEV3TQJVUg,Was this review …?,Useful,Funny,Cool,Others will see how you vote!,https://s3-media3.fl.yelpcdn.com/assets/srv0/yelp_deanonymize_ufc/f871a0ff7872/lib/img/200x120_ufc_globe.png,"Heads up: From now on, other Yelpers will be able to see how you voted. Want to chime in?","Yes, Let Me Vote!",Maybe Later,https://www.yelp.com/flag_content?biz_id=GwQ88sbGm7K1Dnx_qgmt8Q&flag_id=K5kWJ4L4eZ91cVoS9HJu5Q&flag_type=review&previous_url=https%3A%2F%2Fwww.yelp.com%2Fbiz%2Fcharmers-cafe-chicago-4%3Fosq%3Dcafe,Report review,4,1,2 check-ins,[object Object],
https://www.yelp.com/user_details?userid=mszdCnkJL69GMEye8hPuhw,https://s3-media2.fl.yelpcdn.com/photo/7DOw9XOBeSuQB4yx2nl6yQ/60s.jpg,Kristen S.,"Chicago, IL",friends,271,reviews,20,photos,[object Object],47,https://www.yelp.com/biz_share/GwQ88sbGm7K1Dnx_qgmt8Q/review/fUkmpzHoIi4Wa5NQvU9zUg,[object Object],Share review,javascript:;,Embed review,https://www.yelp.com/thanx?complimentable_id=fUkmpzHoIi4Wa5NQvU9zUg&complimentable_type=REVIEW&previous_url=https%3A%2F%2Fwww.yelp.com%2Fbiz%2Fcharmers-cafe-chicago-4%3Fosq%3Dcafe&user_id=mszdCnkJL69GMEye8hPuhw,Compliment,https://www.yelp.com/mail?action_send_form=1&dst=mszdCnkJL69GMEye8hPuhw&return_url=https%3A%2F%2Fwww.yelp.com%2Fbiz%2Fcharmers-cafe-chicago-4%3Fosq%3Dcafe,Send message,https://www.yelp.com/following_user/add?dst_user_id=mszdCnkJL69GMEye8hPuhw&previous_url=https://www.yelp.com/biz/charmers-cafe-chicago-4?osq=cafe,Follow Kristen S.,https://www.yelp.com/following_user/remove?dst_user_id=mszdCnkJL69GMEye8hPuhw&previous_url=https://www.yelp.com/biz/charmers-cafe-chicago-4?osq=cafe,Stop following Kristen S.,https://s3-media2.fl.yelpcdn.com/assets/srv0/yelp_design_web/9b34e39ccbeb/assets/img/stars/stars.png,2/8/2017,"SCHEDULE YOUR NEXT COFFEE DATE HERE. This cafe is a precious hole in the wall! If you are ever in Rogers Park and need a quiet cafe getaway, please come to Charmer's Cafe. You will surely leave in a good mood! The EnvironmentThe employees are very kind and obviously do a great job of setting a positive tone and building rapport with their customers. It was my first time in the cafe, but I noticed that many of the patrons were regulars and had conversations with the staff. There are tables, window stool seats, and swings for you to choose from to sit and enjoy yout coffee! The Drinks: I had a mocha and it was well priced and tasty. I was very satisfied and I can see myself coming back!",https://s3-media2.fl.yelpcdn.com/bphoto/fVD4_IS0zUjRIssldAMELw/348s.jpg,https://www.yelp.com/biz_photos/charmers-cafe-chicago-4?reviewid=fUkmpzHoIi4Wa5NQvU9zUg&select=fVD4_IS0zUjRIssldAMELw,1 person voted for this review,Useful,Funny,Cool,Others will see how you vote!,https://s3-media3.fl.yelpcdn.com/assets/srv0/yelp_deanonymize_ufc/f871a0ff7872/lib/img/200x120_ufc_globe.png,"Heads up: From now on, other Yelpers will be able to see how you voted. Want to chime in?","Yes, Let Me Vote!",Maybe Later,https://www.yelp.com/flag_content?biz_id=GwQ88sbGm7K1Dnx_qgmt8Q&flag_id=fUkmpzHoIi4Wa5NQvU9zUg&flag_type=review&previous_url=https%3A%2F%2Fwww.yelp.com%2Fbiz%2Fcharmers-cafe-chicago-4%3Fosq%3Dcafe,Report review,1,,1 check-in,[object Object],
https://www.yelp.com/user_details?userid=jZszzVIPcssa4oQ24J_3jQ,https://s3-media2.fl.yelpcdn.com/assets/srv0/yelp_styleguide/514f6997a318/assets/img/default_avatars/user_60_square.png,Bill H.,"Chicago, IL",friends,20,reviews,59,photos,[object Object],3,https://www.yelp.com/biz_share/GwQ88sbGm7K1Dnx_qgmt8Q/review/bWdvHRVBgXUV6p6eFunV_A,[object Object],Share review,javascript:;,Embed review,https://www.yelp.com/thanx?complimentable_id=bWdvHRVBgXUV6p6eFunV_A&complimentable_type=REVIEW&previous_url=https%3A%2F%2Fwww.yelp.com%2Fbiz%2Fcharmers-cafe-chicago-4%3Fosq%3Dcafe&user_id=jZszzVIPcssa4oQ24J_3jQ,Compliment,https://www.yelp.com/mail?action_send_form=1&dst=jZszzVIPcssa4oQ24J_3jQ&return_url=https%3A%2F%2Fwww.yelp.com%2Fbiz%2Fcharmers-cafe-chicago-4%3Fosq%3Dcafe,Send message,https://www.yelp.com/following_user/add?dst_user_id=jZszzVIPcssa4oQ24J_3jQ&previous_url=https://www.yelp.com/biz/charmers-cafe-chicago-4?osq=cafe,Follow Bill H.,https://www.yelp.com/following_user/remove?dst_user_id=jZszzVIPcssa4oQ24J_3jQ&previous_url=https://www.yelp.com/biz/charmers-cafe-chicago-4?osq=cafe,Stop following Bill H.,https://s3-media2.fl.yelpcdn.com/assets/srv0/yelp_design_web/9b34e39ccbeb/assets/img/stars/stars.png,5/6/2018,"Great place if you don't want a nice cold brew.not cheap either , reg coffee is $2.75 . Banana peanut butter smoothie was excellent. How can you call yourself a cafe and not have cold brew in 2018?",,,Was this review …?,Useful,Funny,Cool,Others will see how you vote!,https://s3-media3.fl.yelpcdn.com/assets/srv0/yelp_deanonymize_ufc/f871a0ff7872/lib/img/200x120_ufc_globe.png,"Heads up: From now on, other Yelpers will be able to see how you voted. Want to chime in?","Yes, Let Me Vote!",Maybe Later,https://www.yelp.com/flag_content?biz_id=GwQ88sbGm7K1Dnx_qgmt8Q&flag_id=bWdvHRVBgXUV6p6eFunV_A&flag_type=review&previous_url=https%3A%2F%2Fwww.yelp.com%2Fbiz%2Fcharmers-cafe-chicago-4%3Fosq%3Dcafe,Report review,,,,,
https://www.yelp.com/user_details?userid=LzhiHi3u9P7wH0JEGMUd8w,https://s3-media3.fl.yelpcdn.com/photo/ZamokVHEdgSZBB1PFNrxVg/60s.jpg,Brianna K.,"Milwaukee, WI",friends,151,reviews,111,photos,[object Object],111,https://www.yelp.com/biz_share/GwQ88sbGm7K1Dnx_qgmt8Q/review/z_cLiaZbsAxTqqzRnkHigw,[object Object],Share review,javascript:;,Embed review,https://www.yelp.com/thanx?complimentable_id=z_cLiaZbsAxTqqzRnkHigw&complimentable_type=REVIEW&previous_url=https%3A%2F%2Fwww.yelp.com%2Fbiz%2Fcharmers-cafe-chicago-4%3Fosq%3Dcafe&user_id=LzhiHi3u9P7wH0JEGMUd8w,Compliment,https://www.yelp.com/mail?action_send_form=1&dst=LzhiHi3u9P7wH0JEGMUd8w&return_url=https%3A%2F%2Fwww.yelp.com%2Fbiz%2Fcharmers-cafe-chicago-4%3Fosq%3Dcafe,Send message,https://www.yelp.com/following_user/add?dst_user_id=LzhiHi3u9P7wH0JEGMUd8w&previous_url=https://www.yelp.com/biz/charmers-cafe-chicago-4?osq=cafe,Follow Brianna K.,https://www.yelp.com/following_user/remove?dst_user_id=LzhiHi3u9P7wH0JEGMUd8w&previous_url=https://www.yelp.com/biz/charmers-cafe-chicago-4?osq=cafe,Stop following Brianna K.,https://s3-media2.fl.yelpcdn.com/assets/srv0/yelp_design_web/9b34e39ccbeb/assets/img/stars/stars.png,9/18/2016,"This morning, we moseyed over to Charmer's Cafe to do some job applications and poetry revision. Gotta say, the decor is ideal for artistic pursuits. Love the textured tin ceiling and the hanging globe lights. The layout is unique and suits the character of the cafe. Nestled in the corner of the U-shaped bench, I could stay here for a good long while. The eavesdropping is satisfying (we heard tell of a first edition Kurt Vonnegut) and the music isn't overpowering.Food and drink: My mocha and my companion's iced chai hit the spot. We also impulse bought two scones (bacon cheddar and chocolate) which are big for scones and delicious. Service: Cheerful and quirky. The man who made our drinks started them up before we finished paying, and they were out just as quickly.",,,2 people voted for this review,Useful,Funny,Cool,Others will see how you vote!,https://s3-media3.fl.yelpcdn.com/assets/srv0/yelp_deanonymize_ufc/f871a0ff7872/lib/img/200x120_ufc_globe.png,"Heads up: From now on, other Yelpers will be able to see how you voted. Want to chime in?","Yes, Let Me Vote!",Maybe Later,https://www.yelp.com/flag_content?biz_id=GwQ88sbGm7K1Dnx_qgmt8Q&flag_id=z_cLiaZbsAxTqqzRnkHigw&flag_type=review&previous_url=https%3A%2F%2Fwww.yelp.com%2Fbiz%2Fcharmers-cafe-chicago-4%3Fosq%3Dcafe,Report review,2,,,,1
https://www.yelp.com/user_details?userid=jXX-G_goCYZZrLSDY8qXdg,https://s3-media2.fl.yelpcdn.com/photo/rXvsM4vsvrhmLKXu10HRbQ/60s.jpg,Tian Y.,"Saint Louis, MO",friends,168,reviews,515,photos,[object Object],69,https://www.yelp.com/biz_share/GwQ88sbGm7K1Dnx_qgmt8Q/review/POg5k5CkXLJae9eMVwZZ_A,[object Object],Share review,javascript:;,Embed review,https://www.yelp.com/thanx?complimentable_id=POg5k5CkXLJae9eMVwZZ_A&complimentable_type=REVIEW&previous_url=https%3A%2F%2Fwww.yelp.com%2Fbiz%2Fcharmers-cafe-chicago-4%3Fosq%3Dcafe&user_id=jXX-G_goCYZZrLSDY8qXdg,Compliment,https://www.yelp.com/mail?action_send_form=1&dst=jXX-G_goCYZZrLSDY8qXdg&return_url=https%3A%2F%2Fwww.yelp.com%2Fbiz%2Fcharmers-cafe-chicago-4%3Fosq%3Dcafe,Send message,https://www.yelp.com/following_user/add?dst_user_id=jXX-G_goCYZZrLSDY8qXdg&previous_url=https://www.yelp.com/biz/charmers-cafe-chicago-4?osq=cafe,Follow Tian Y.,https://www.yelp.com/following_user/remove?dst_user_id=jXX-G_goCYZZrLSDY8qXdg&previous_url=https://www.yelp.com/biz/charmers-cafe-chicago-4?osq=cafe,Stop following Tian Y.,https://s3-media2.fl.yelpcdn.com/assets/srv0/yelp_design_web/9b34e39ccbeb/assets/img/stars/stars.png,7/23/2016,"Charmer's Cafe is for ... the neighborhood. It is the perfect shop to have at that location, where  it serves as a gathering place for the community, meet up with some friends on the patio and catch up, or a Sunday morning reading/crossword puzzle session. It's also especially for families in the summer to stop by for an ice cream cone or a shake. The new decor is very sophisticated yet laid back, and those gorgeous swinging bar seats can totally be the talk of the town. Staff is very friendly, and seem to really know the neighborhood. For me, I mostly come for the convenient cup of coffee right before my occasional train ride to work. I have never come during the typical rush hour, and so far I have almost never gotten a latte since they aren't quite fast enough for me to not miss my train. The couple of times I had espresso drinks, they were far from perfect. The pastries... are very local, but every time I've given in out of hunger, I have found them to be too dry/staled. Students, if you want a quiet place to study with intense focus, the lighting inside is probably too dim, and people do chat a lot here.I like the fact that Charmer's is here, and it has such an important role on this block. But even after a few months of opening, I don't know if I would recommend it with fervor to people who don't live around here/aren't already passing by. Definitely not if great coffee is your No. 1 priority in choosing a coffee shop.",,,voted for this review,Useful,Funny,Cool,Others will see how you vote!,https://s3-media3.fl.yelpcdn.com/assets/srv0/yelp_deanonymize_ufc/f871a0ff7872/lib/img/200x120_ufc_globe.png,"Heads up: From now on, other Yelpers will be able to see how you voted. Want to chime in?","Yes, Let Me Vote!",Maybe Later,https://www.yelp.com/flag_content?biz_id=GwQ88sbGm7K1Dnx_qgmt8Q&flag_id=POg5k5CkXLJae9eMVwZZ_A&flag_type=review&previous_url=https%3A%2F%2Fwww.yelp.com%2Fbiz%2Fcharmers-cafe-chicago-4%3Fosq%3Dcafe,Report review,2,1,,,1
https://www.yelp.com/user_details?userid=YvnDZ_SDUhK98LcJ_YFNQQ,https://s3-media1.fl.yelpcdn.com/photo/X2xVxUDdLzU12RtzZwHN2g/60s.jpg,Peter O.,"Chicago, IL",friends,45,reviews,159,photos,[object Object],5,https://www.yelp.com/biz_share/GwQ88sbGm7K1Dnx_qgmt8Q/review/DBWMyIEnDv2zqtOK-pB7nw,[object Object],Share review,javascript:;,Embed review,https://www.yelp.com/thanx?complimentable_id=DBWMyIEnDv2zqtOK-pB7nw&complimentable_type=REVIEW&previous_url=https%3A%2F%2Fwww.yelp.com%2Fbiz%2Fcharmers-cafe-chicago-4%3Fosq%3Dcafe&user_id=YvnDZ_SDUhK98LcJ_YFNQQ,Compliment,https://www.yelp.com/mail?action_send_form=1&dst=YvnDZ_SDUhK98LcJ_YFNQQ&return_url=https%3A%2F%2Fwww.yelp.com%2Fbiz%2Fcharmers-cafe-chicago-4%3Fosq%3Dcafe,Send message,https://www.yelp.com/following_user/add?dst_user_id=YvnDZ_SDUhK98LcJ_YFNQQ&previous_url=https://www.yelp.com/biz/charmers-cafe-chicago-4?osq=cafe,Follow Peter O.,https://www.yelp.com/following_user/remove?dst_user_id=YvnDZ_SDUhK98LcJ_YFNQQ&previous_url=https://www.yelp.com/biz/charmers-cafe-chicago-4?osq=cafe,Stop following Peter O.,https://s3-media2.fl.yelpcdn.com/assets/srv0/yelp_design_web/9b34e39ccbeb/assets/img/stars/stars.png,3/7/2017,"Charmers is back, new and improved. Delicious coffee and espresso drinks, pastries, croissants, muffins, bagels with and without cream cheese, light sandwiches. No more steamed bagel sandwiches. Delightful environment both indoors and out. Lovely staff of happy, friendly people. Sunday morning at Charmers followed by a walk to the lakefront and a view of the well landscaped Frank Lloyd Wright houses on Sheridan accompanied by Charmers coffee begin the day perfectly.Peter O. and S.",,,4 people voted for this review,Useful,Funny,Cool,Others will see how you vote!,https://s3-media3.fl.yelpcdn.com/assets/srv0/yelp_deanonymize_ufc/f871a0ff7872/lib/img/200x120_ufc_globe.png,"Heads up: From now on, other Yelpers will be able to see how you voted. Want to chime in?","Yes, Let Me Vote!",Maybe Later,https://www.yelp.com/flag_content?biz_id=GwQ88sbGm7K1Dnx_qgmt8Q&flag_id=DBWMyIEnDv2zqtOK-pB7nw&flag_type=review&previous_url=https%3A%2F%2Fwww.yelp.com%2Fbiz%2Fcharmers-cafe-chicago-4%3Fosq%3Dcafe,Report review,4,1,2 check-ins,[object Object],
https://www.yelp.com/user_details?userid=D0EQMABr4Ixv8WLOc-57gw,https://s3-media4.fl.yelpcdn.com/photo/5WylwTnfwcvxLXE18LAMeA/60s.jpg,Rose J.,"Chicago, IL",friends,5,reviews,6,photos,[object Object],11,https://www.yelp.com/biz_share/GwQ88sbGm7K1Dnx_qgmt8Q/review/fl290kYoZP2kFuPq0moSAg,[object Object],Share review,javascript:;,Embed review,https://www.yelp.com/thanx?complimentable_id=fl290kYoZP2kFuPq0moSAg&complimentable_type=REVIEW&previous_url=https%3A%2F%2Fwww.yelp.com%2Fbiz%2Fcharmers-cafe-chicago-4%3Fosq%3Dcafe&user_id=D0EQMABr4Ixv8WLOc-57gw,Compliment,https://www.yelp.com/mail?action_send_form=1&dst=D0EQMABr4Ixv8WLOc-57gw&return_url=https%3A%2F%2Fwww.yelp.com%2Fbiz%2Fcharmers-cafe-chicago-4%3Fosq%3Dcafe,Send message,https://www.yelp.com/following_user/add?dst_user_id=D0EQMABr4Ixv8WLOc-57gw&previous_url=https://www.yelp.com/biz/charmers-cafe-chicago-4?osq=cafe,Follow Rose J.,https://www.yelp.com/following_user/remove?dst_user_id=D0EQMABr4Ixv8WLOc-57gw&previous_url=https://www.yelp.com/biz/charmers-cafe-chicago-4?osq=cafe,Stop following Rose J.,https://s3-media2.fl.yelpcdn.com/assets/srv0/yelp_design_web/9b34e39ccbeb/assets/img/stars/stars.png,10/13/2016,"So, after deleting my yelp reviews after some storage issues, I decided to write another reviw for this place.Great atmosphere, I love the pastries and beverages. As my neice likes to say, yaaaas queen!Two cons. The selection gets worse as the day goes by. Also, they NEED TO BE MORE SANITARY. I love you, Charmers. Wash your hands.",https://s3-media3.fl.yelpcdn.com/bphoto/aWK9gFOVafZpbE3k8lKZzA/348s.jpg,https://www.yelp.com/biz_photos/charmers-cafe-chicago-4?reviewid=fl290kYoZP2kFuPq0moSAg&select=aWK9gFOVafZpbE3k8lKZzA,2 people voted for this review,Useful,Funny,Cool,Others will see how you vote!,https://s3-media3.fl.yelpcdn.com/assets/srv0/yelp_deanonymize_ufc/f871a0ff7872/lib/img/200x120_ufc_globe.png,"Heads up: From now on, other Yelpers will be able to see how you voted. Want to chime in?","Yes, Let Me Vote!",Maybe Later,https://www.yelp.com/flag_content?biz_id=GwQ88sbGm7K1Dnx_qgmt8Q&flag_id=fl290kYoZP2kFuPq0moSAg&flag_type=review&previous_url=https%3A%2F%2Fwww.yelp.com%2Fbiz%2Fcharmers-cafe-chicago-4%3Fosq%3Dcafe,Report review,,1,6 check-ins,[object Object],1
https://www.yelp.com/user_details?userid=irPqVkawWpnwRnDi9Ec41Q,https://s3-media2.fl.yelpcdn.com/assets/srv0/yelp_styleguide/514f6997a318/assets/img/default_avatars/user_60_square.png,Chris V.,"Des Plaines, IL",friend,1,reviews,27,photos,[object Object],7,https://www.yelp.com/biz_share/GwQ88sbGm7K1Dnx_qgmt8Q/review/zcpG99Ld7-KyfB0v1xj89g,[object Object],Share review,javascript:;,Embed review,https://www.yelp.com/thanx?complimentable_id=zcpG99Ld7-KyfB0v1xj89g&complimentable_type=REVIEW&previous_url=https%3A%2F%2Fwww.yelp.com%2Fbiz%2Fcharmers-cafe-chicago-4%3Fosq%3Dcafe&user_id=irPqVkawWpnwRnDi9Ec41Q,Compliment,https://www.yelp.com/mail?action_send_form=1&dst=irPqVkawWpnwRnDi9Ec41Q&return_url=https%3A%2F%2Fwww.yelp.com%2Fbiz%2Fcharmers-cafe-chicago-4%3Fosq%3Dcafe,Send message,https://www.yelp.com/following_user/add?dst_user_id=irPqVkawWpnwRnDi9Ec41Q&previous_url=https://www.yelp.com/biz/charmers-cafe-chicago-4?osq=cafe,Follow Chris V.,https://www.yelp.com/following_user/remove?dst_user_id=irPqVkawWpnwRnDi9Ec41Q&previous_url=https://www.yelp.com/biz/charmers-cafe-chicago-4?osq=cafe,Stop following Chris V.,https://s3-media2.fl.yelpcdn.com/assets/srv0/yelp_design_web/9b34e39ccbeb/assets/img/stars/stars.png,11/12/2017,"Fairly quiet coffee shop at the corner of Jarvis and Greenview. Didn't get coffee today. But, if you're a fan of Metropolis coffee, this is your place. Also a good place if you're looking for a quiet place to read or study. Food wise, an average offering of sandwiches and smoothies. I was disappointed that they forgot my order for a vegan smoothie. But, because they didn't bill me for it, I let it go.",,,Was this review …?,Useful,Funny,Cool,Others will see how you vote!,https://s3-media3.fl.yelpcdn.com/assets/srv0/yelp_deanonymize_ufc/f871a0ff7872/lib/img/200x120_ufc_globe.png,"Heads up: From now on, other Yelpers will be able to see how you voted. Want to chime in?","Yes, Let Me Vote!",Maybe Later,https://www.yelp.com/flag_content?biz_id=GwQ88sbGm7K1Dnx_qgmt8Q&flag_id=zcpG99Ld7-KyfB0v1xj89g&flag_type=review&previous_url=https%3A%2F%2Fwww.yelp.com%2Fbiz%2Fcharmers-cafe-chicago-4%3Fosq%3Dcafe,Report review,,,,,
https://www.yelp.com/user_details?userid=1Mw-A4h9yWqd-a5IRvN5yQ,https://s3-media2.fl.yelpcdn.com/assets/srv0/yelp_styleguide/514f6997a318/assets/img/default_avatars/user_60_square.png,Roy M.,"Chicago Loop, Chicago, IL",friends,266,reviews,5,,,,https://www.yelp.com/biz_share/GwQ88sbGm7K1Dnx_qgmt8Q/review/LpWRedLnPt05Co7cQzrW7g,[object Object],Share review,javascript:;,Embed review,https://www.yelp.com/thanx?complimentable_id=LpWRedLnPt05Co7cQzrW7g&complimentable_type=REVIEW&previous_url=https%3A%2F%2Fwww.yelp.com%2Fbiz%2Fcharmers-cafe-chicago-4%3Fosq%3Dcafe&user_id=1Mw-A4h9yWqd-a5IRvN5yQ,Compliment,https://www.yelp.com/mail?action_send_form=1&dst=1Mw-A4h9yWqd-a5IRvN5yQ&return_url=https%3A%2F%2Fwww.yelp.com%2Fbiz%2Fcharmers-cafe-chicago-4%3Fosq%3Dcafe,Send message,https://www.yelp.com/following_user/add?dst_user_id=1Mw-A4h9yWqd-a5IRvN5yQ&previous_url=https://www.yelp.com/biz/charmers-cafe-chicago-4?osq=cafe,Follow Roy M.,https://www.yelp.com/following_user/remove?dst_user_id=1Mw-A4h9yWqd-a5IRvN5yQ&previous_url=https://www.yelp.com/biz/charmers-cafe-chicago-4?osq=cafe,Stop following Roy M.,https://s3-media2.fl.yelpcdn.com/assets/srv0/yelp_design_web/9b34e39ccbeb/assets/img/stars/stars.png,2/7/2018,"This is by far the most amazing coffee shop on the planet. The bagel sandwiches are ridiculously amazing. The coffee is great, and their latte is spectacular. Catch them at the right time at the end of a coffee batch, and they give everybody in the room free coffee. Amazing service, super friendly, super respectful. The music selection is super varied and everybody gets a taste of something great. Super cozy! Their huge windows let you see a super snowy beautiful day in the comfort of a winter heated and cozy woody ambience. I feel at home, losing myself in my work for hours.",,,voted for this review,Useful,Funny,Cool,Others will see how you vote!,https://s3-media3.fl.yelpcdn.com/assets/srv0/yelp_deanonymize_ufc/f871a0ff7872/lib/img/200x120_ufc_globe.png,"Heads up: From now on, other Yelpers will be able to see how you voted. Want to chime in?","Yes, Let Me Vote!",Maybe Later,https://www.yelp.com/flag_content?biz_id=GwQ88sbGm7K1Dnx_qgmt8Q&flag_id=LpWRedLnPt05Co7cQzrW7g&flag_type=review&previous_url=https%3A%2F%2Fwww.yelp.com%2Fbiz%2Fcharmers-cafe-chicago-4%3Fosq%3Dcafe,Report review,1,2,,,
https://www.yelp.com/user_details?userid=wtaoFyuRj_2HytEvQuokWg,https://s3-media3.fl.yelpcdn.com/photo/CWnaiSDl4vhsOdkFQRBsjA/60s.jpg,Matthew S.,"Chicago, IL",friends,56,reviews,6,,,,https://www.yelp.com/biz_share/GwQ88sbGm7K1Dnx_qgmt8Q/review/lV_Qj_oSGR8vFTmEAqb37A,[object Object],Share review,javascript:;,Embed review,https://www.yelp.com/thanx?complimentable_id=lV_Qj_oSGR8vFTmEAqb37A&complimentable_type=REVIEW&previous_url=https%3A%2F%2Fwww.yelp.com%2Fbiz%2Fcharmers-cafe-chicago-4%3Fosq%3Dcafe&user_id=wtaoFyuRj_2HytEvQuokWg,Compliment,https://www.yelp.com/mail?action_send_form=1&dst=wtaoFyuRj_2HytEvQuokWg&return_url=https%3A%2F%2Fwww.yelp.com%2Fbiz%2Fcharmers-cafe-chicago-4%3Fosq%3Dcafe,Send message,https://www.yelp.com/following_user/add?dst_user_id=wtaoFyuRj_2HytEvQuokWg&previous_url=https://www.yelp.com/biz/charmers-cafe-chicago-4?osq=cafe,Follow Matthew S.,https://www.yelp.com/following_user/remove?dst_user_id=wtaoFyuRj_2HytEvQuokWg&previous_url=https://www.yelp.com/biz/charmers-cafe-chicago-4?osq=cafe,Stop following Matthew S.,https://s3-media2.fl.yelpcdn.com/assets/srv0/yelp_design_web/9b34e39ccbeb/assets/img/stars/stars.png,11/14/2017,This place is so over priced. I purchased a small hot chocolate for over $3 and when I got home this is what I found. The milk was way too over foamed so when it settled it was only half way filled. Coffee is also mediocre for the price. You can get better at Starbucks for less money. Really should rethink there business model and training for staff.,,,Was this review …?,Useful,Funny,Cool,Others will see how you vote!,https://s3-media3.fl.yelpcdn.com/assets/srv0/yelp_deanonymize_ufc/f871a0ff7872/lib/img/200x120_ufc_globe.png,"Heads up: From now on, other Yelpers will be able to see how you voted. Want to chime in?","Yes, Let Me Vote!",Maybe Later,https://www.yelp.com/flag_content?biz_id=GwQ88sbGm7K1Dnx_qgmt8Q&flag_id=lV_Qj_oSGR8vFTmEAqb37A&flag_type=review&previous_url=https%3A%2F%2Fwww.yelp.com%2Fbiz%2Fcharmers-cafe-chicago-4%3Fosq%3Dcafe,Report review,,,,,
https://www.yelp.com/user_details?userid=aB7TSaJGo8g9bflxxygqEA,https://s3-media1.fl.yelpcdn.com/photo/b1vSZwNQ2gxOOrBBBJqL8Q/60s.jpg,Sarah G.,"Chicago, IL",friends,84,reviews,46,photos,[object Object],5,https://www.yelp.com/biz_share/GwQ88sbGm7K1Dnx_qgmt8Q/review/4ACGKvDfqzdBzEVdb_xsOg,[object Object],Share review,javascript:;,Embed review,https://www.yelp.com/thanx?complimentable_id=4ACGKvDfqzdBzEVdb_xsOg&complimentable_type=REVIEW&previous_url=https%3A%2F%2Fwww.yelp.com%2Fbiz%2Fcharmers-cafe-chicago-4%3Fosq%3Dcafe&user_id=aB7TSaJGo8g9bflxxygqEA,Compliment,https://www.yelp.com/mail?action_send_form=1&dst=aB7TSaJGo8g9bflxxygqEA&return_url=https%3A%2F%2Fwww.yelp.com%2Fbiz%2Fcharmers-cafe-chicago-4%3Fosq%3Dcafe,Send message,https://www.yelp.com/following_user/add?dst_user_id=aB7TSaJGo8g9bflxxygqEA&previous_url=https://www.yelp.com/biz/charmers-cafe-chicago-4?osq=cafe,Follow Sarah G.,https://www.yelp.com/following_user/remove?dst_user_id=aB7TSaJGo8g9bflxxygqEA&previous_url=https://www.yelp.com/biz/charmers-cafe-chicago-4?osq=cafe,Stop following Sarah G.,https://s3-media2.fl.yelpcdn.com/assets/srv0/yelp_design_web/9b34e39ccbeb/assets/img/stars/stars.png,8/4/2017,"Cute place, friendly staff, good food, wifi, and outdoor seating. I love that you can satisfy most cravings here - they have delicious coffee, bagels, donuts, and ice cream. Yum!",,,1 person voted for this review,Useful,Funny,Cool,Others will see how you vote!,https://s3-media3.fl.yelpcdn.com/assets/srv0/yelp_deanonymize_ufc/f871a0ff7872/lib/img/200x120_ufc_globe.png,"Heads up: From now on, other Yelpers will be able to see how you voted. Want to chime in?","Yes, Let Me Vote!",Maybe Later,https://www.yelp.com/flag_content?biz_id=GwQ88sbGm7K1Dnx_qgmt8Q&flag_id=4ACGKvDfqzdBzEVdb_xsOg&flag_type=review&previous_url=https%3A%2F%2Fwww.yelp.com%2Fbiz%2Fcharmers-cafe-chicago-4%3Fosq%3Dcafe,Report review,1,,,,
